{
  "schema": "stellar-verification-page",
  "schema_version": "1.0",
  "order": "asc",
  "cursor": "1788869642019-3f8c2a1b9e4d7c05a6b3f8129d4e5a7c0b1d2e3f4a5b6c7d8e9f0a1b2c3d4e5f",
  "records": [
    {
      "wasm_hash": "7d1e4b9a2c6f08315e8d0a4b7c2f9e6d3a0b5c8f1e4d7a0b3c6f9e2d5a8b1c40",
      "updated_at": "2026-09-08T11:02:47.881Z"
    },
    {
      "wasm_hash": "3f8c2a1b9e4d7c05a6b3f8129d4e5a7c0b1d2e3f4a5b6c7d8e9f0a1b2c3d4e5f",
      "updated_at": "2026-09-08T12:14:02.019Z"
    }
  ]
}
